Mã sản phẩm,Tên sản phẩm,Giá,Doanh thu,Tên cửa hàng,Tỉ lệ hoa hồng,Hoa hồng,Link sản phẩm,Link ưu đãi
29522842263,[BW Gift mới]  Sữa dưỡng thể Vaseline 70ml (mẫu ngẫu nhiên),"200,0k",200k+,Unilever Chăm Sóc Sắc Đẹp,"4,5%",₫8.000,https://shopee.vn/product/1397276155/29522842263,https://s.shopee.vn/3fyobJ36CC
40774336580,"[Sample 2ml] [Hàng Tặng Kèm Không Bán] Kem Dưỡng BEPLAIN PDRN Rau Má đàn hồi & trẻ hóa làn da, cấp ẩm & căng bóng Cica PDRN 2ml","180,0k",70k+,Beplain Vietnam,"4,5%",₫7.200,https://shopee.vn/product/468195803/40774336580,https://s.shopee.vn/3qIEnc2SrF
44305151205,"[Sample 2ml] [ Hàng Tặng Kèm Không Bán] Tinh Chất Serum Rau Má PDRN – Phục Hồi, Cấp Ẩm, Căng bóng, Tái Sinh Làn da & Giúp da săn chắc 2ml","200,0k",70k+,Beplain Vietnam,"4,5%",₫8.000,https://shopee.vn/product/468195803/44305151205,https://s.shopee.vn/3LLyCh4MsA
24127826015,"Kem dưỡng Cao cấp Five Grains trắng da Niacinamide, Alpha-Arbutin nâng tone ban ngày 200ML","159,0k",100k+,Five Grains Vietnam,"12,5%",₫19.080,https://shopee.vn/product/562490219/24127826015,https://s.shopee.vn/3VfOP03jXD
25894465179,"[10ml Hàng Tặng Kèm Không Bán] Tinh chất BEPLAIN PDRN Rau Má phục hồi & tái sinh tổn thương cho da trẻ hoá, cấp ẩm & căng bóng Cica PDRN Skin Booster Serum 10ml","200,0k",80k+,Beplain Vietnam,"4,5%",₫8.000,https://shopee.vn/product/468195803/25894465179,https://s.shopee.vn/4LEVOX0YqO
531577271,[DAILY] Kem Rửa Mặt Hada Labo Sạch Sâu Dưỡng Ẩm 80g Hasaki Sản Phẩm Chính Hãng,"68,0k",300k+,HASAKI VIETNAM,"4,5%",₫2.720,https://shopee.vn/product/18644537/531577271,https://s.shopee.vn/4VXvapzvVR
22504415135,Ositree Kem lót mặt trang điểm Kem lót cách ly Kem dưỡng ẩm Hydrating Brightening  Tone-up25g,"160,0k",80k+,Ositree Official flagship,"13,5%",₫20.800,https://shopee.vn/product/850624476/22504415135,https://s.shopee.vn/40bezv1pWM
29118467747,Serum Vaseline Gluta-Hya Dưỡng Da Sáng Mịn Sau 7 Ngày 300ML/330 ML (tùy đợt nhập hàng),"140,0k",200k+,Unilever Chăm Sóc Sắc Đẹp,"10,5%",₫14.000,https://shopee.vn/product/1397276155/29118467747,https://s.shopee.vn/4Av5CE1CBP
42521803525,OSITREE Face Primer Trang điểm BasePrier lsolation Kem dưỡng ẩmHydrating Bright Kem che khuyết điểm Toneup25g,"160,0k",20k+,Ositree Official flagship,"14,5%",₫22.400,https://shopee.vn/product/850624476/42521803525,https://s.shopee.vn/50UCBky1Ua
8878211498,"[Torriden Chính hãng] Kem dưỡng làm dịu da DIVE IN chứa Hyaluronic Acid, 100ml, Soothing Cream","343,2k",100k+,VN_Torriden Official Store,"19,5%",₫65.208,https://shopee.vn/product/436346871/8878211498,https://s.shopee.vn/5AncO3xO9d
23915942301,Kem Lót Dưỡng Ẩm JUDYDOLL Nourishing Makeup Base Chống Mốc Nền Giữ nền lâu trôi Cho da khô 30g,"209,0k",90k+,Judydoll Official Store,"16,5%",₫33.440,https://shopee.vn/product/341989119/23915942301,https://s.shopee.vn/4frLn8zIAY
21619809513,Bộ Serum Glycolic Melasyl 8% [Melasyl+Glycolic+Niacinamide] 30ml & Kem dưỡng ngày đêm mờ thâm nám L'Oreal Paris Glycolic,"469,0k",300k+,L'Oreal Paris Official Store,"9,5%",₫42.210,https://shopee.vn/product/37251933/21619809513,https://s.shopee.vn/4qAlzRyepb
29172489261,AZTK Son Kem Lì Dưỡng Màu Mềm Mịn Lâu Trôi 1.9g,"119,0k",20k+,AZTK.VN,"9,5%",₫10.710,https://shopee.vn/product/1431102203/29172489261,https://s.shopee.vn/LiMdBFmxk
42517930095,[HB GIFT 5] Kem mắt 5ml cho mặt Chống lão hóa PROSHOT COLLA-JUVENATION LIFT 4 5ML,"1,0tr",10k+,AHC Vietnam Official Store,"4,5%",₫40.000,https://shopee.vn/product/219192749/42517930095,https://s.shopee.vn/W1mpUF9cn
56505889262,[QUÀ TẶNG KHÔNG BÁN] Kem dưỡng kết cấu mochi căng mọng da 7ml,"700,0k",7k+,Garnier Official Store,"4,5%",₫28.000,https://shopee.vn/product/421677475/56505889262,https://s.shopee.vn/15WEZH3di
44103947407,Serum Dưỡng Thể NIVEA 10 Super Vitamins & Skin Foods Sáng Da/Vitamin Extra Bright C&AHA Dưỡng Sáng (300ml) - 93824/99197,"176,0k",70k+,NIVEA VN OFFICIAL STORE,"14,5%",₫24.640,https://shopee.vn/product/61922582/44103947407,https://s.shopee.vn/BOwQsGQIl
21473335559,Kem dưỡng ẩm & phục hồi đa năng La Roche-Posay Cicaplast Baume B5+ giúp phục hồi da sau 1 lần sử dụng - phiên bản 40ml,"383,0k",100k+,La Roche-Posay Chính Hãng,"12,5%",₫45.960,https://shopee.vn/product/37251700/21473335559,https://s.shopee.vn/10y3QPDFbw
21732934778,Kem dưỡng ẩm phục hồi chuyên sâu và giữ da ẩm mịn suốt 48H CERAVE MOISTURISING CREAM 50ML,"171,0k",100k+,CeraVe Official Store,"12,5%",₫20.520,https://shopee.vn/product/812449960/21732934778,https://s.shopee.vn/1BHTciCcGz
1042697070,Sữa Dưỡng Thể NIVEA Sáng Da Ban Đêm 8 Super Foods (350 ml) – 98412,"131,0k",300k+,NIVEA VN OFFICIAL STORE,"14,5%",₫18.340,https://shopee.vn/product/61922582/1042697070,https://s.shopee.vn/gLD1nEWHu
19128682241,"Combo kem tẩy lông và kem dưỡng Ollie tẩy vùng kín, nách, tay, chân , an toàn không đau rát,dưỡng da phù hợp mọi loại da","172,0k",500k+,Hecatech Official Store,"16,5%",₫27.520,https://shopee.vn/product/238383015/19128682241,https://s.shopee.vn/qedE6Dswx
